{
  "ts": "2026-05-09T07:00:00Z",
  "level": "debug",
  "target": "mcp_agent_mail::git_lock",
  "name": "git_repo_lock_acquired",
  "fields": {
    "repo_slug": "data-projects-demo",
    "caller": "git_cmd.run",
    "args_hash": "0123456789abcdef0123456789abcdef0123456789abcdef0123456789abcdef",
    "duration_ms": 1,
    "outcome": "success",
    "git_version": "2.50.1",
    "lock_kind": "process_mutex",
    "wait_seconds": 0
  }
}
